<xs:schema xmlns:xs="http://www.w3.org/2001/XMLSchema">
    <xs:element name="menu">
        <xs:complexType>
            <xs:sequence>
                <xs:element name="plat" maxOccurs="unbounded">
                    <xs:complexType>
                        <xs:sequence>
                            <xs:element name="nom"></xs:element>
                            <xs:element name="tipus"></xs:element>
                            <xs:element name="preu">
                                <xs:complexType>
                                    <xs:simpleContent>
                                        <xs:extension base="xs:decimal">
                                            <xs:attribute name="moneda" type="xs:string"></xs:attribute>
                                        </xs:extension>
                                    </xs:simpleContent>
                                </xs:complexType>
                            </xs:element>
                        </xs:sequence>
                        <xs:attribute name="id" type="xs:string"/>
                    </xs:complexType>
                </xs:element>
            </xs:sequence>
        </xs:complexType>
        
    </xs:element>
</xs:schema>